{
  "$schema": "https://json-schema.org/draft/2020-12/schema",
  "$id": "https://organchor.org/schemas/official-endpoints.v1.json",
  "type": "object",
  "required": [
    "schema",
    "type",
    "version",
    "statement_id",
    "issued_at",
    "organization",
    "root_authority",
    "root_authority_hash",
    "official_endpoints",
    "archives",
    "disaster_recovery",
    "auxiliary_names",
    "domain_security",
    "notes"
  ],
  "properties": {
    "schema": { "const": "https://organchor.org/schemas/official-endpoints.v1.json" },
    "type": { "const": "OfficialOrganizationEndpoints" },
    "version": { "const": "1.0" },
    "statement_id": { "type": "string", "minLength": 1 },
    "issued_at": {
      "type": "string",
      "pattern": "^\\d{4}-\\d{2}-\\d{2}T\\d{2}:\\d{2}:\\d{2}(?:\\.\\d{3})?Z$"
    },
    "organization": {
      "type": "object",
      "required": ["name", "display_name"],
      "properties": {
        "name": { "type": "string", "minLength": 1 },
        "display_name": { "type": "string", "minLength": 1 },
        "description": { "type": "string" }
      }
    },
    "root_authority": { "type": "object" },
    "root_authority_hash": { "type": "string", "pattern": "^sha256:[0-9a-f]{64}$" },
    "official_endpoints": { "type": "object" },
    "archives": {
      "type": "object",
      "required": ["arweave", "ipfs"],
      "properties": {
        "arweave": { "type": "array" },
        "ipfs": { "type": "array" }
      }
    },
    "disaster_recovery": { "type": "object" },
    "auxiliary_names": { "type": "object" },
    "domain_security": { "type": "object" },
    "notes": { "type": "string" }
  }
}
